{
  "name": "columnValuesToBeInSet",
  "fullyQualifiedName": "columnValuesToBeInSet",
  "displayName": "Column Values To Be In Set",
  "description": "This schema defines the test ColumnValuesToBeInSet. Test the column values are in the set.",
  "entityType": "COLUMN",
  "testPlatforms": ["UMetadata"],
  "supportedDataTypes": ["NUMBER", "INT", "FLOAT", "DOUBLE", "DECIMAL", "TINYINT", "SMALLINT", "BIGINT", "BYTEINT", "BYTES", "STRING", "MEDIUMTEXT", "TEXT", "CHAR", "VARCHAR", "BOOLEAN", "LOWCARDINALITY"],
  "parameterDefinition": [
    {
      "name": "allowedValues",
      "displayName": "Allowed Values",
      "description": "An Array of values.",
      "dataType": "ARRAY",
      "required": true
    },
    {
      "name": "matchEnum",
      "displayName": "Match enum",
      "description": "If enabled, validate that each value independently matches the enum.",
      "dataType": "BOOLEAN",
      "required": false
    }
  ],
  "supportsRowLevelPassedFailed": true,
  "provider": "system",
  "enabled": true,
  "dataQualityDimension": "Validity",
  "validatorClass": "ColumnValuesToBeInSetValidator"
}
