{
    "name": "columnValueMedianToBeBetween",
    "fullyQualifiedName": "columnValueMedianToBeBetween",
    "displayName": "Column Value Median To Be Between",
    "description": "This schema defines the test ColumnValueMedianToBeBetween. Test the median value in a col is within a range.",
    "entityType": "COLUMN",
    "testPlatforms": ["UMetadata"],
    "supportedDataTypes": ["NUMBER", "INT", "FLOAT", "DOUBLE", "DECIMAL", "TINYINT", "SMALLINT", "BIGINT", "BYTEINT"],
    "parameterDefinition": [
      {
        "name": "minValueForMedianInCol",
        "displayName": "Min",
        "description": "Expected median value for the column to be greater or equal than",
        "dataType": "INT",
        "validationRule": {
          "parameterField": "maxValueForMedianInCol",
          "rule": "LESS_THAN_OR_EQUALS"
        }
      },
      {
        "name": "maxValueForMedianInCol",
        "displayName": "Max",
        "description": "Expected median value for the column to be lower or equal than",
        "dataType": "INT",
        "validationRule": {
          "parameterField": "minValueForMedianInCol",
          "rule": "GREATER_THAN_OR_EQUALS"
        }
      }
  ],
  "supportsDynamicAssertion": true,
  "provider": "system",
  "enabled": true,
  "dataQualityDimension": "Accuracy",
  "validatorClass": "ColumnValueMedianToBeBetweenValidator"
}
  