{
    "name": "columnValuesToBeUnique",
    "fullyQualifiedName": "columnValuesToBeUnique",
    "displayName": "Column Values To Be Unique",
    "description": "This schema defines the test ColumnValuesToBeUnique. Test the values in a column to be unique. ",
    "entityType": "COLUMN",
    "testPlatforms": [
        "UMetadata"
    ],
    "supportedDataTypes": [
        "NUMBER",
        "TINYINT",
        "SMALLINT",
        "INT",
        "BIGINT",
        "BYTEINT",
        "BYTES",
        "FLOAT",
        "DOUBLE",
        "DECIMAL",
        "NUMERIC",
        "TIMESTAMP",
        "TIMESTAMPZ",
        "TIME",
        "DATE",
        "DATETIME",
        "INTERVAL",
        "STRING",
        "MEDIUMTEXT",
        "TEXT",
        "CHAR",
        "VARCHAR",
        "BOOLEAN",
        "BINARY",
        "VARBINARY",
        "BLOB",
        "LONGBLOB",
        "MEDIUMBLOB",
        "MAP",
        "STRUCT",
        "UNION",
        "SET",
        "GEOGRAPHY",
        "ENUM",
        "UUID",
        "VARIANT",
        "GEOMETRY",
        "POINT",
        "POLYGON",
        "LOWCARDINALITY"
    ],
    "supportsRowLevelPassedFailed": true,
    "provider": "system",
  "enabled": true,
    "dataQualityDimension": "Uniqueness",
    "validatorClass": "ColumnValuesToBeUniqueValidator"
}
