{
    "name": "tableColumnNameToExist",
    "fullyQualifiedName": "tableColumnNameToExist",
    "displayName": "Table Column Name To Exist",
    "description": "This test defines the test TableColumnNameToExist. Test the table columns exists in the table.",
    "entityType": "TABLE",
    "testPlatforms": ["UMetadata"],
    "parameterDefinition": [
      {
        "name": "columnName",
        "displayName": "Column Name",
        "description": "Expected column of the table to exist",
        "dataType": "STRING",
        "required": true
      }
    ],
    "provider": "system",
  "enabled": true,
    "dataQualityDimension": "Integrity",
    "validatorClass": "TableColumnNameToExistValidator"
  }
  