{
    "name": "columnValueMinToBeBetween",
    "fullyQualifiedName": "columnValueMinToBeBetween",
    "displayName": "Column Value Min. To Be Between",
    "description": "This schema defines the test ColumnValueMinToBeBetween. Test the minimum value in a col is within a range.",
    "entityType": "COLUMN",
    "testPlatforms": ["UMetadata"],
    "supportedDataTypes": ["NUMBER", "INT", "FLOAT", "DOUBLE", "DECIMAL", "TINYINT", "SMALLINT", "BIGINT", "BYTEINT"],
    "parameterDefinition": [
      {
        "name": "minValueForMinInCol",
        "displayName": "Min",
        "description": "Expected minimum value in the column to be greater or equal than",
        "dataType": "INT",
        "validationRule": {
          "parameterField": "maxValueForMinInCol",
          "rule": "LESS_THAN_OR_EQUALS"
        }
      },
      {
        "name": "maxValueForMinInCol",
        "displayName": "Max",
        "description": "Expect minimum value in the column to be lower or equal than",
        "dataType": "INT",
        "validationRule": {
          "parameterField": "minValueForMeanInCol",
          "rule": "GREATER_THAN_OR_EQUALS"
        }
      }
    ],
    "supportsDynamicAssertion": true,
    "provider": "system",
  "enabled": true,
    "dataQualityDimension": "Accuracy",
    "validatorClass": "ColumnValueMinToBeBetweenValidator"
  }
  