{
  "name": "columnValuesToBeNotInSet",
  "fullyQualifiedName": "columnValuesToBeNotInSet",
  "displayName": "Column Values To Be Not In Set",
  "description": "This schema defines the test ColumnValuesToBeNotInSet. Test the column values to not be in the set. ",
  "entityType": "COLUMN",
  "testPlatforms": ["UMetadata"],
  "supportedDataTypes": ["NUMBER", "INT", "FLOAT", "DOUBLE", "DECIMAL", "TINYINT", "SMALLINT", "BIGINT", "BYTEINT", "BYTES", "STRING", "MEDIUMTEXT", "TEXT", "CHAR", "VARCHAR", "BOOLEAN", "LOWCARDINALITY"],
  "parameterDefinition": [
    {
      "name": "forbiddenValues",
      "displayName": "Forbidden Values",
      "description": "An Array of values.",
      "dataType": "ARRAY",
      "required": true
    }
  ],
  "supportsRowLevelPassedFailed": true,
  "provider": "system",
  "enabled": true,
  "dataQualityDimension": "Validity",
  "validatorClass": "ColumnValuesToBeNotInSetValidator"
}
