{
    "name": "columnValueStdDevToBeBetween",
    "fullyQualifiedName": "columnValueStdDevToBeBetween",
    "displayName": "Column Value Std Dev To Be Between",
    "description": "This schema defines the test ColumnValueStdDevToBeBetween. Test the std. dev. value in a col is within a range.",
    "entityType": "COLUMN",
    "testPlatforms": ["UMetadata"],
    "supportedDataTypes": ["NUMBER", "INT", "FLOAT", "DOUBLE", "DECIMAL", "TINYINT", "SMALLINT", "BIGINT", "BYTEINT"],
    "parameterDefinition": [
      {
        "name": "minValueForStdDevInCol",
        "displayName": "Min",
        "description": "Expected std. dev value for the column to be greater or equal than",
        "dataType": "INT",
        "validationRule": {
          "parameterField": "maxValueForStdDevInCol",
          "rule": "LESS_THAN_OR_EQUALS"
        }
      },
      {
        "name": "maxValueForStdDevInCol",
        "displayName": "Max",
        "description": "Expected std. dev value for the column to be lower or equal than",
        "dataType": "INT",
        "validationRule": {
          "parameterField": "minValueForStdDevInCol",
          "rule": "GREATER_THAN_OR_EQUALS"
        }
      }
    ],
    "supportsDynamicAssertion": true,
    "provider": "system",
  "enabled": true,
    "dataQualityDimension": "Accuracy",
    "validatorClass": "ColumnValueStdDevToBeBetweenValidator"
  }
  